id,url,title
148,https://www.un.org/techenvoy/sites/www.un.org.techenvoy/files/GDC-submission_United-Kingdom.pdf,"Submission by the United Kingdom, April 2023PDF"
149,https://www.un.org/techenvoy/sites/www.un.org.techenvoy/files/GDC-submission_R3D.pdf,"Submission by Red en Defensa de los Derechos Digitales (R3D), April 2023PDF"
150,https://www.un.org/techenvoy/sites/www.un.org.techenvoy/files/GDC-submission_Republica-de-Cuba.pdf,"Submission by República de Cuba, April 2023PDF"
151,https://www.un.org/techenvoy/sites/www.un.org.techenvoy/files/GDC-submission_Emmanuelle-Duquenne.pdf,"Submission by Emmanuelle Duquenne, April 2023PDF"
152,https://www.un.org/techenvoy/sites/www.un.org.techenvoy/files/GDC-submission_Wikimedia-Foundation.pdf,"Submission by the Wikimedia Foundation, April 2023PDF"
153,https://www.un.org/techenvoy/sites/www.un.org.techenvoy/files/GDC-submission_UNGIS.pdf,"Submission by the United Nations Group on the Information Society (UNGIS), April 2023PDF"
154,https://www.un.org/techenvoy/sites/www.un.org.techenvoy/files/GDC-submission_Cloudflare.pdf,"Submission by Cloudflare, April 2023PDF"
155,https://www.un.org/techenvoy/sites/www.un.org.techenvoy/files/GDC-submissio_Avaaz-Foundation.pdf,"Submission by the Avaaz Foundation, April 2023PDF"
156,https://www.un.org/techenvoy/sites/www.un.org.techenvoy/files/GDC-submission_Youth-for-Privacy.pdf,"Submission by Youth for Privacy, April 2023PDF"
157,https://www.un.org/techenvoy/sites/www.un.org.techenvoy/files/GDC-submission_5Rights.pdf,"Submission by the 5Rights Foundation, April 2023PDF"
158,https://www.un.org/techenvoy/sites/www.un.org.techenvoy/files/GDC-submission_Meta.pdf,"Submission by Meta, April 2023PDF"
159,https://www.un.org/techenvoy/sites/www.un.org.techenvoy/files/GDC-submission_ICRC.pdf,"Submission by the International Committee of the Red Cross (ICRC), April 2023PDF"
160,https://www.un.org/techenvoy/sites/www.un.org.techenvoy/files/GDC-submission_-FES-ITfC.pdf,"Submission by the Friedrich Ebert Stiftung (FES) and IT for Change, April 2023 PDF"
161,https://www.un.org/techenvoy/sites/www.un.org.techenvoy/files/GDC-submission_Global-Digital-Justice-Forum.pdf,"Submission by the Global Digital Justice Forum, April 2023PDF"
162,https://www.un.org/techenvoy/sites/www.un.org.techenvoy/files/GDC-submission_25_Stakeholders_in_the_field_of_Artificial_Intelligence.pdf,"Submission by 25 stakeholders in the field of AI, April 2023PDF"
163,https://www.un.org/techenvoy/sites/www.un.org.techenvoy/files/GDC-submission_Switzerland.pdf,"Submission by Switzerland, April 2023PDF"
164,https://www.un.org/techenvoy/sites/www.un.org.techenvoy/files/GDC-submission_joint-submission-on-targeted-surveillance_0.pdf,"Submission by Amnesty International, April 2023PDF"
165,https://www.un.org/techenvoy/sites/www.un.org.techenvoy/files/GDC-submission_Colombian-IGF_0.pdf,"Submission by the Colombian IGF, April 2023PDF"
166,https://www.un.org/techenvoy/sites/www.un.org.techenvoy/files/GDC-submission_Microsoft.pdf,"Submission by Microsoft, April 2023PDF"
167,https://www.un.org/techenvoy/sites/www.un.org.techenvoy/files/GDC-submission_Article19.pdf,"Submission by Article19, April 2023PDF"
168,https://www.un.org/techenvoy/sites/www.un.org.techenvoy/files/GDC-submission_UN-Habitat.pdf,"Submission by UN Habitat, April 2023PDF"
169,https://www.un.org/techenvoy/sites/www.un.org.techenvoy/files/GDC-submission_OHCHR.pdf,"Submission by the Office of the United Nations High Commissioner for Human Rights (OHCHR), April 2023PDF"
170,https://www.un.org/techenvoy/sites/www.un.org.techenvoy/files/GDC-submission_France.pdf,"Submission by France, April 2023PDF"
171,https://www.un.org/techenvoy/sites/www.un.org.techenvoy/files/GDC-submission_AlSur.pdf,"Submission by Al Sur, April 2023PDF"
172,https://www.un.org/techenvoy/sites/www.un.org.techenvoy/files/GDC-submission_Open_Internet_for_Democracy.pdf,"Submission by Open Internet for Democracy, April 2023PDF"
173,https://www.un.org/techenvoy/sites/www.un.org.techenvoy/files/GDC-submission_China-IGF_0.pdf,"Submission by China IGF, April 2023PDF"
174,https://www.un.org/techenvoy/sites/www.un.org.techenvoy/files/GDC-submission_CCGNLUD.pdf,"Submission by the Center for Communication Governance at National Law University Delhi, April 2023PDF"
175,https://www.un.org/techenvoy/sites/www.un.org.techenvoy/files/GDC-submission_Digital-National-Alliance-Bulgaria_0.pdf,"Submission by Digital National Alliance Bulgaria, April 2023PDF"
176,https://www.un.org/techenvoy/sites/www.un.org.techenvoy/files/GDC-submission_China.pdf,"Submission by China, April 2023PDF"
177,https://www.un.org/techenvoy/sites/www.un.org.techenvoy/files/GDC-submission_Japan.pdf,"Submission by Japan, April 2023PDF"
178,https://www.un.org/techenvoy/sites/www.un.org.techenvoy/files/GDC-submission-UNU-EHS.pdf,"Submission by United Nations University Institute for Environment and Human Security, April 2023"
